{
  "name": "BepiColombo",
  "type": "ORBITADOR · ACTIVA",
  "first": "Primera misión planetaria conjunta Europa-Japón; segunda nave en orbitar Mercurio (tras Messenger)",
  "description": "Misión conjunta ESA / JAXA a Mercurio, lanzada el 20-10-2018 — nombrada por el matemático italiano Giuseppe (Bepi) Colombo, que diseñó la trayectoria de múltiples sobrevuelos de Mariner 10. El crucero de 8 años usa 9 asistencias gravitatorias (Tierra 2020, Venus 2020, Venus 2021, luego seis sobrevuelos de Mercurio 2021-2024) más empuje iónico-eléctrico continuo. Inserción en órbita de Mercurio el 5-12-2026; las operaciones científicas comienzan a principios de 2027."
}
