{
  "name": "यूलिसिस",
  "type": "सौर ध्रुवीय ऑर्बिटर · पूर्ण",
  "first": "अब तक एकमात्र अंतरिक्षयान जो उच्च-झुकाव सूर्यकेंद्रित कक्षा में प्रवेश किया; सौर पवन के सभी हेलियोग्राफिक अक्षांशों पर एकमात्र प्रत्यक्ष माप",
  "description": "ईएसए / नासा का संयुक्त मिशन। 6-10-1990 को STS-41 डिस्कवरी से लॉन्च, यूलिसिस ने 8-2-1992 को बृहस्पति की गुरुत्व सहायता का उपयोग करके खुद को क्रांतिवृत्त से ~80° दूर मोड़ा — पृथ्वी के लगभग-भूमध्यरेखीय कक्षीय तल से सूर्य-सापेक्ष ध्रुवीय कक्षा तक पहुंचने का एकमात्र तरीका। 18.5 वर्षों में सूर्य की तीन पूर्ण ध्रुवीय कक्षाओं ने सौर पवन, हेलियोस्फेरिक चुंबकीय क्षेत्र और सभी हेलियोग्राफिक अक्षांशों पर ऊर्जावान कणों का मानचित्रण किया। मिशन 30-6-2009 को समाप्त हुआ जब थ्रस्टर लाइनों में हाइड्राज़ीन जम गई।"
}
