{
  "name": "एटलस V 541",
  "type": "मध्यम-लिफ्ट, एक बार उपयोग",
  "first": "पहला प्रक्षेपण वाहन जिसने दूसरी दुनिया पर परमाणु-संचालित रोवर पहुँचाया",
  "description": "ULA एटलस V: 5 मीटर फेयरिंग, चार ठोस रॉकेट बूस्टर, और एक इंजन वाला सेन्टॉर ऊपरी चरण। नवंबर 2011 में क्यूरियोसिटी को मंगल भेजा। 2024 में वल्कन सेन्टॉर के पक्ष में सेवानिवृत्त।"
}
